{
  "schema_version": "1.0.0",
  "receipt_id": "rcpt_1f8b7c55-3f4d-4ea0-9b9f-9c2cf7fbac21",
  "created_at": "2026-03-28T00:28:40Z",
  "event": { "event_type": "export", "event_ref": "sess_dc_0007", "unit_basis": "flat", "quantity": 1 },
  "gross": { "amount": 100.0, "currency": "CAD" },
  "splits": {
    "rule": "75_25",
    "artist_pool": { "amount": 75.0, "percent": 0.75 },
    "platform_pool": { "amount": 25.0, "percent": 0.25 },
    "contributors": [
      { "contributor_id": "RSP_001", "display_name": "Rob Plowman", "role": "origin_voice", "amount": 45.0, "share_of_artist_pool": 0.6 },
      { "contributor_id": "VSI_TIMOTHY_CHANG", "display_name": "Timothy Chang", "role": "language_library", "amount": 30.0, "share_of_artist_pool": 0.4 }
    ]
  },
  "attribution": {
    "source_contributions": [
      { "contribution_id": "contrib_01", "contributor_id": "VSI_TIMOTHY_CHANG", "asset_ref": "langlib_mandarin_v1", "consent_token_ref": "token_9a12..." },
      { "contribution_id": "contrib_02", "contributor_id": "RSP_001", "asset_ref": "voice_dna_rsp001_v1", "consent_token_ref": "token_1b44..." }
    ],
    "display_credit_line": "Hybrid voice built from RSP_001 + Timothy Chang (Mandarin library)."
  },
  "proof_links": { "artifact_id": "art_4a2f...", "manifest_id": "man_2b11...", "consent_decision_ids": ["consent_77a..."], "memcell_id": "mem_317" },
  "status": { "state": "issued" }
}
